<?xml version="1.0" encoding="UTF-8"?>
<!-- edited with XMLSpy v2013 rel. 2 sp2 (http://www.altova.com) by eResept (Helsedirektoratet) -->
<StandardMetadata definisjonVersjon="" xmlns:xsi="http://www.w3.org/2001/XMLSchema-instance" xsi:noNamespaceSchemaLocation="../Metadata.xsd">
	<Temaer>
		<Tema>E-reseptmeldinger</Tema>
	</Temaer>
	<Navn>Mellom Statens legemiddelverk og Reseptformidleren m.fl.</Navn>
	<Utgitt>07/2018</Utgitt>
	<Ansvarlig>Direktoratet for e-helse</Ansvarlig>
	<Status>Fastsatt som standard</Status>
	<MerInformasjon>
		<Informasjon>
			<Beskrivelse>Om bruk og målgrupper</Beskrivelse>
			<Referanse>https://ehelse.no/referansekatalog/referansekatalogen-for-ehelse#E-reseptmeldinger</Referanse>
		</Informasjon>
	</MerInformasjon>

	<Kravdokumenter>
		<Kravdokument>
			<Beskrivelse>eResept – Verify-melding (PDF)</Beskrivelse>
			<Referanse>kravdokument/eresept/eResept-MV-2013-08-16.pdf</Referanse>
		</Kravdokument>
		<Kravdokument>
			<Beskrivelse>eResept - M3 Anmodning om søknad til SLV - M14 Søknadtil SLV - M15 Søknadssvar fra SLV (PDF)</Beskrivelse>
			<Referanse>kravdokument/eresept/R1108-eResept-M3-M14-M15-2013-04-16.pdf</Referanse>
		</Kravdokument>
		<Kravdokument>
			<Beskrivelse>eResept - Utleveringsrapporter M6, M8, M8.1, M10 og M20 (PDF)</Beskrivelse>
			<Referanse>kravdokument/eresept/R1308-eResept-M6-M8-M81-M10-M20-2015-09-22.pdf</Referanse>
		</Kravdokument>
		<Kravdokument>
			<Beskrivelse>eResept – M30 FEST og Forskrivning (PDF)</Beskrivelse>
			<Referanse>kravdokument/eresept/R1808-eResept-M30-2013-10-08.pdf</Referanse>
		</Kravdokument>
		<Kravdokument>
			<Beskrivelse>eResept – M30 FEST og Forskrivning (PDF)</Beskrivelse>
			<Referanse>kravdokument/eresept/R1808-eResept-M30-2014-12-01.pdf</Referanse>
		</Kravdokument>
	</Kravdokumenter>
	
	<Skjemaer>
		<Skjema>
			<Referanse>skjema/eresept/M3-M14-M15/ER-M14-2008-12-12.xsd</Referanse>
			<Namespace>http://www.kith.no/xmlstds/eresept/m14/2008-12-12</Namespace>
		</Skjema>
		<Skjema>
			<Referanse>skjema/eresept/M3-M14-M15/ER-M15-2006-10-06.xsd</Referanse>
			<Namespace>http://www.kith.no/xmlstds/eresept/m15/2006-10-06</Namespace>
		</Skjema>
		<Skjema>
			<Referanse>skjema/eresept/M6-M8-M81-M10-M20/ER-M10-2013-10-08.xsd</Referanse>
			<Namespace>http://www.kith.no/xmlstds/eresept/m10/2013-10-08</Namespace>
		</Skjema>
		<Skjema>
			<Referanse>skjema/eresept/M6-M8-M81-M10-M20/ER-M20-2013-10-08.xsd</Referanse>
			<Namespace>http://www.kith.no/xmlstds/eresept/m20/2013-10-08</Namespace>
		</Skjema>
		<Skjema>
			<Referanse>skjema/eresept/M30/ER-M30-2013-10-08.xsd</Referanse>
			<Namespace>http://www.kith.no/xmlstds/eresept/m30/2013-10-08</Namespace>
		</Skjema>
		<Skjema>
			<Referanse>skjema/eresept/M30/ER-M30-2013-10-08-loose.xsd</Referanse>
			<Namespace>http://www.kith.no/xmlstds/eresept/m30/2013-10-08</Namespace>
		</Skjema>
		<Skjema>
			<Referanse>skjema/eresept/M30/ER-M30-2014-12-01.xsd</Referanse>
			<Namespace>http://www.kith.no/xmlstds/eresept/m30/2014-12-01</Namespace>
		</Skjema>
		<Skjema>
			<Referanse>skjema/eresept/M30/ER-M30-2014-12-01-loose.xsd</Referanse>
			<Namespace>http://www.kith.no/xmlstds/eresept/m30/2014-12-01</Namespace>
		</Skjema>
		<Skjema>
			<Referanse>skjema/eresept/MV/ER-MV-2013-08-16.xsd</Referanse>
			<Namespace>http://www.kith.no/xmlstds/eresept/mv/2013-08-16</Namespace>
		</Skjema>
		<Skjema>
			<Referanse>skjema/eresept/MV/ER-MV-2017-01-01.xsd</Referanse>
			<Namespace>http://ehelse.no/xmlstds/eresept/mv/2017-01-01</Namespace>
		</Skjema>
	</Skjemaer>
	<Felleskomponenter>
		<Felleskomponent>
			<Referanse>skjema/felleskomponenter/MsgHead-v1_2.xsd</Referanse>
		</Felleskomponent>
		<Felleskomponent>
			<Referanse>skjema/felleskomponenter/kith-base64.xsd</Referanse>
		</Felleskomponent>
	</Felleskomponenter>
	<Visningsfiler>
		<Visningsfil>
			<Referanse>visningsfil/eresept/m15/m15-2html-v2.5.xsl</Referanse>
		</Visningsfil>
	</Visningsfiler>
	<Eksempler>
		
		<Eksempel>
			<Referanse>eksempel/eresept/ER-M14-2008-12-12-eksempel1.xml</Referanse>
		</Eksempel>
		<Eksempel>
			<Referanse>eksempel/eresept/ER-M14-2008-12-12-eksempel1-msghead.xml</Referanse>
		</Eksempel>
		<Eksempel>
			<Referanse>eksempel/eresept/ER-M15-2006-10-06-eksempel1-msghead.xml</Referanse>
		</Eksempel>
	</Eksempler>
	
	<RelaterteFiler>
		<RelatertFil>
			<Beskrivelse>Applikasjonskvittering v 1.0</Beskrivelse>
			<Referanse>kravdokument/applikasjonskvittering/HIS_80415_2004 AppRec v1.0 -korrigert.pdf</Referanse>
		</RelatertFil>
		<RelatertFil>
			<Beskrivelse>Notat til bruk av kith-base.xsd</Beskrivelse>
			<Referanse>relaterteFiler/eresept/NOTAT-kith-base64.pdf</Referanse>
		</RelatertFil>
		<RelatertFil>
			<Beskrivelse>Hodemelding v 1.2</Beskrivelse>
			<Referanse>kravdokument/hodemelding/HIS_80601_2006-Hodemelding-v12 -korrigert.pdf</Referanse>
		</RelatertFil>
		<RelatertFil>
			<Beskrivelse>Datatyper v 1.1</Beskrivelse>
			<Referanse>kravdokument/DatatyperTilBrukVedMeldingsutveksling/HIS_80117_2002_Datatyper_v1.1 -korrigert.pdf</Referanse>
		</RelatertFil>
		<RelatertFil>
			<Beskrivelse>Notat - Opplysninger om signerende helsepersoenell i meldinger fra Helseforetak til NAV og Reseptformidleren</Beskrivelse>
			<Referanse>relaterteFiler/eresept/Signerende_HelsepersonellSykmelding-eResept-notat.pdf</Referanse>
		</RelatertFil>
	</RelaterteFiler>	
	
	
</StandardMetadata>
