<?xml version="1.0" encoding="UTF-8"?>
<!-- edited with XMLSpy v2013 rel. 2 sp2 (http://www.altova.com) by eResept (Helsedirektoratet) -->
<StandardMetadata definisjonVersjon="" xmlns:xsi="http://www.w3.org/2001/XMLSchema-instance" xsi:noNamespaceSchemaLocation="../Metadata.xsd">
	<Navn>Teststandard</Navn>
	<Versjon>1.0</Versjon>
	<Identifikator>BG-1234</Identifikator>
	<Utgivelsesdato>2016-02-12</Utgivelsesdato>
	<Utgiver>Direktoratet for e-helse</Utgiver>
	<Status>Utgått</Status>
	<StatusReferansekatalog>Utgått</StatusReferansekatalog>
	<ErstattetAv>ingenting</ErstattetAv>
	<Standardtekster>
		<Standardtekst>
			<Beskrivelse>En standardtekst</Beskrivelse>
			<Referanse>standardtekst/FEILTeststandard/test.txt</Referanse>
		</Standardtekst>
	</Standardtekster>
	<Skjemaer>
		<Skjema>
			<Referanse>skjema/FEILTeststandard/test.txt</Referanse>
			<Namespace>http://www.kith.no/xmlstds/test/9999-01-01</Namespace>
		</Skjema>
	</Skjemaer>
	<Felleskomponenter>
		<Felleskomponent>
			<Beskrivelse>Felles datatyper</Beskrivelse>
			<Referanse>skjema/FEILfelleskomponenter/kith.xsd</Referanse>
		</Felleskomponent>
	</Felleskomponenter>
	<Modellfiler>
		<Modell>
			<Beskrivelse>En modell</Beskrivelse>
			<Referanse>informasjonsmodell/FEILTeststandard/test.txt</Referanse>
		</Modell>
	</Modellfiler>
	<Visningsfiler>
		<Visningsfil>
			<Beskrivelse>En visningsfil</Beskrivelse>
			<Referanse>visningsfil/FEILTeststandard/test.txt</Referanse>
		</Visningsfil>
	</Visningsfiler>
		<Testmateriell>
		<Testfil>
			<Beskrivelse>En testfil</Beskrivelse>
			<Referanse>test/FEILTeststandard/test.txt</Referanse>
		</Testfil>
	</Testmateriell>
	<Eksempler>
		<Eksempel>
			<Referanse>eksempel/FEILTeststandard/test.txt</Referanse>
		</Eksempel>
	</Eksempler>
	<RelaterteFiler>
		<RelatertFil>
			<Beskrivelse>Hodemleding TEST</Beskrivelse>
			<Referanse>eksempel/FEILTeststandard/test.txt</Referanse>
		</RelatertFil>
	</RelaterteFiler>
</StandardMetadata>
