<?xml version="1.0" encoding="UTF-8"?>
<!-- edited with XMLSpy v2013 rel. 2 sp2 (http://www.altova.com) by eResept (Helsedirektoratet) -->
<StandardMetadata definisjonVersjon="" xmlns:xsi="http://www.w3.org/2001/XMLSchema-instance" xsi:noNamespaceSchemaLocation="../Metadata.xsd">
	<Navn>ebXML Rammeverk</Navn>
	<Versjon>1.1</Versjon>
	<Identifikator>HIS 1037:2011</Identifikator>
	<Utgitt>06/2011</Utgitt>
	<Ansvarlig>Direktoratet for e-helse</Ansvarlig>
	<Status>Fastsatt som standard</Status>	
	<MerInformasjon>
		<Informasjon>
			<Beskrivelse>ebXML Rammeverk 1.1</Beskrivelse>
			<Referanse>http://ehelse.no/HIS1037-2011</Referanse>
		</Informasjon>
	</MerInformasjon>


	<Kravdokumenter>
		<Kravdokument>
			<Beskrivelse>ebXML Rammeverk 1.1 (PDF)</Beskrivelse>
			<Referanse>kravdokument/EBXMLrammeverk/HIS 1037_2011 Rammeverk for meldingsutveksling v1.1 -korrigert.pdf</Referanse>
		</Kravdokument>
	</Kravdokumenter>
	<RelaterteFiler>
		<RelatertFil>
			<Beskrivelse>Veiledning til riktig implementasjon og bruk av ebXML (PDF)</Beskrivelse>
			<Referanse>relaterteFiler/EBXMLrammeverk/HISD 1171_2017 Veiledning til riktig implementasjon og bruk av ebXML v1.0.pdf</Referanse>
		</RelatertFil>
		<RelatertFil>
			<Beskrivelse>Validering av ebXML-meldinger (PDF)</Beskrivelse>
			<Referanse>relaterteFiler/EBXMLrammeverk/HISD 1172_2017 Validering av ebXML-meldinger.pdf</Referanse>
		</RelatertFil>
		<RelatertFil>
			<Beskrivelse>Implementasjonsguide API for bruk av kommunikasjonsparametere (PDF)</Beskrivelse>
			<Referanse>relaterteFiler/EBXMLrammeverk/HISD_1177_2017 Implementasjonsguide API for bruk av kommunikasjonsparametere.pdf</Referanse>
		</RelatertFil>
		<RelatertFil>
			<Beskrivelse>Service, Action og Role i ebXML-konvolutten (PDF)</Beskrivelse>
			<Referanse>relaterteFiler/EBXMLrammeverk/HISD_1209_2018 Service_Action_og_Role i ebXML-konvolutten.pdf</Referanse>
		</RelatertFil>
		<RelatertFil>
			<Beskrivelse>Overvåkning av meldingsversjoner i ebXML (PDF)</Beskrivelse>
			<Referanse>relaterteFiler/EBXMLrammeverk/HISD_1210_2018 Overvåkning av meldingsversjoner i ebXML.pdf</Referanse>
		</RelatertFil>
	</RelaterteFiler>

</StandardMetadata>
