<?xml version="1.0" encoding="UTF-8"?>
<!-- edited with XMLSpy v2013 rel. 2 sp2 (http://www.altova.com) by eResept (Helsedirektoratet) -->
<StandardMetadata definisjonVersjon="" xmlns:xsi="http://www.w3.org/2001/XMLSchema-instance" xsi:noNamespaceSchemaLocation="../Metadata.xsd">
	<Navn>Pasientens fastlege</Navn>
	<Versjon>1.0</Versjon>
	<Identifikator>HIS 1022:2010</Identifikator>
	<Utgivelsesdato>2010-02-01</Utgivelsesdato>
	<Utgiver>Helsedirektoratet</Utgiver>
	<Status>Til utbredelse</Status>
	<StatusReferansekatalog>Aktiv</StatusReferansekatalog>
	<Standardtekster>
		<Standardtekst>
			<Beskrivelse>Forespørsel om fastlege. Informasjonsmodell og XML meldingsbeskrivelse (PDF)</Beskrivelse>
			<Referanse>standardtekst/HELFOPasientensFastlege/HIS_1022_2010_NAV-Fastlege-2010-02-01.pdf</Referanse>
		</Standardtekst>
	</Standardtekster>
	<Skjemaer>
		<Skjema>
			<Referanse>skjema/HELFOPasientensFastlege/NAV-Fastlege-2010-02-01.xsd</Referanse>
			<Namespace>http://www.kith.no/xmlstds/nav/fastlege/2010-02-01</Namespace>
		</Skjema>
	</Skjemaer>
	<Felleskomponenter>
		<Felleskomponent>
			<Beskrivelse>XML-skjema for Hodemelding</Beskrivelse>
			<Referanse>skjema/felleskomponenter/MsgHead-v1_2.xsd</Referanse>
		</Felleskomponent>
		<Felleskomponent>
			<Beskrivelse>Felles XML-definisjoner for person, helsepersonell, organisasjon etc</Beskrivelse>
			<Referanse>skjema/felleskomponenter/felleskomponent1.xsd</Referanse>
		</Felleskomponent>
		<Felleskomponent>
			<Beskrivelse>Felles datatyper</Beskrivelse>
			<Referanse>skjema/felleskomponenter/kith.xsd</Referanse>
		</Felleskomponent>
	</Felleskomponenter>
	<RelaterteFiler>
		<RelatertFil>
			<Beskrivelse>Referansekatalog-oppføring for Forespørsel om fastlege (HIS 1022:2010)</Beskrivelse>
			<Referanse>https://ehelse.no/Sider/Foresp%c3%b8rsel-om-fastlege--Informasjonsmodell-og-XML-meldingsbeskrivelse-%e2%80%93-HIS-10222010.aspx</Referanse>
		</RelatertFil>
	</RelaterteFiler>
</StandardMetadata>
