<?xml version="1.0" encoding="UTF-8"?>
<!-- edited with XMLSpy v2013 rel. 2 sp2 (http://www.altova.com) by eResept (Helsedirektoratet) -->
<StandardMetadata definisjonVersjon="" xmlns:xsi="http://www.w3.org/2001/XMLSchema-instance" xsi:noNamespaceSchemaLocation="../Metadata.xsd">
	<Navn>Henvisningsmelding</Navn>
	<Versjon>1.1</Versjon>
	<Identifikator>HIS 80517:2014</Identifikator>
	<Utgitt>02/2014</Utgitt>

	<Referansekatalogen>
		<Beskrivelse>Henvisningsmelding 1.1 (HIS 80517:2014)</Beskrivelse>
		<Referanse>https://ehelse.no/Sider/Henvisning--Informasjonsmodell-og-XML-meldingsbeskrivelse-%E2%80%93-HIS-805172014.aspx</Referanse>
	</Referansekatalogen>

	<Status>Fastsatt som standard</Status>

	<ForrigeVersjon>HIS 80517:2005</ForrigeVersjon>
	
	<Kravdokumenter>
		<Kravdokument>
			<Beskrivelse>Henvisning. Informasjonsmodell og XML meldingsbeskrivelse (PDF)</Beskrivelse>
			<Referanse>kravdokument/henvisning/HIS_80517_2014_Henvisning_v1-1-2014-02-13.pdf</Referanse>
		</Kravdokument>
	</Kravdokumenter>
	
	<Skjemaer>
		<Skjema>
			<Referanse>skjema/henvisning/Henvisning-v1.1.xsd</Referanse>
			<Namespace>http://www.kith.no/xmlstds/Henvisning/2012-02-15</Namespace>
		</Skjema>
	</Skjemaer>
	
	<Felleskomponenter>
		<Felleskomponent>
			<Beskrivelse>Felles XML-definisjoner for person, helsepersonell, organisasjon etc</Beskrivelse>
			<Referanse>skjema/felleskomponenter/felleskomponent1.xsd</Referanse>
		</Felleskomponent>
		<Felleskomponent>
			<Beskrivelse>Felles datatyper</Beskrivelse>
			<Referanse>skjema/felleskomponenter/kith.xsd</Referanse>
		</Felleskomponent>
		<Felleskomponent>
			<Beskrivelse>Container for Base64-kodet innhold</Beskrivelse>
			<Referanse>skjema/felleskomponenter/kith-base64.xsd</Referanse>
		</Felleskomponent>
	</Felleskomponenter>
	
	<Visningsfiler>
		<Visningsfil>
			<Referanse>visningsfil/henvisning/v1.1/henvisning-v1_1-2html.xsl</Referanse>
		</Visningsfil>
		<Visningsfil>
			<Beskrivelse>Felleskomponent for alle visningsfiler: KITH-visning.css</Beskrivelse>
			<Referanse>visningsfil/felleskomponenter/KITH-visning.css</Referanse>
		</Visningsfil>
		<Visningsfil>
			<Beskrivelse>Funksjonsfil som benyttes for alle visningsfiler: base64decoder.xsl</Beskrivelse>
			<Referanse>visningsfil/felleskomponenter/base64decoder.xsl</Referanse>
		</Visningsfil>
		<Visningsfil>
			<Beskrivelse>Funksjonsfil som benyttes for alle visningsfiler: base64-konverterer.xsl</Beskrivelse>
			<Referanse>visningsfil/felleskomponenter/base64-konverterer.xsl</Referanse>
		</Visningsfil>
		<Visningsfil>
			<Beskrivelse>Funksjonsfil som benyttes for alle visningsfiler:cave2html.xsl</Beskrivelse>
			<Referanse>visningsfil/felleskomponenter/cave2html.xsl</Referanse>
		</Visningsfil>
		<Visningsfil>
			<Beskrivelse>Funksjonsfil som benyttes for alle visningsfiler:datamap.xml</Beskrivelse>
			<Referanse>visningsfil/felleskomponenter/datamap.xml</Referanse>
		</Visningsfil>
		<Visningsfil>
			<Beskrivelse>Funksjonsfil som benyttes for alle visningsfiler: EPJ-cave2html.xsl</Beskrivelse>
			<Referanse>visningsfil/felleskomponenter/EPJ-cave2html.xsl</Referanse>
		</Visningsfil>
		<Visningsfil>
			<Beskrivelse>Funksjonsfil som benyttes for alle visningsfiler: EPJ-journalnotat2html.xsl</Beskrivelse>
			<Referanse>visningsfil/felleskomponenter/EPJ-journalnotat2html.xsl</Referanse>
		</Visningsfil>
		<Visningsfil>
			<Beskrivelse>Funksjonsfil som benyttes for alle visningsfiler: EPJ-legemiddel2html.xsl</Beskrivelse>
			<Referanse>visningsfil/felleskomponenter/EPJ-legemiddel2html.xsl</Referanse>
		</Visningsfil>
		<Visningsfil>
			<Beskrivelse>Funksjonsfil som benyttes for alle visningsfiler: funksjoner.xsl</Beskrivelse>
			<Referanse>visningsfil/felleskomponenter/funksjoner.xsl</Referanse>
		</Visningsfil>
		<Visningsfil>
			<Beskrivelse>Funksjonsfil som benyttes for alle visningsfiler: journalnotat2html.xsl</Beskrivelse>
			<Referanse>visningsfil/felleskomponenter/journalnotat2html.xsl</Referanse>
		</Visningsfil>
		<Visningsfil>
			<Beskrivelse>Funksjonsfil som benyttes for alle visningsfiler: kodeverk.xsl</Beskrivelse>
			<Referanse>visningsfil/felleskomponenter/kodeverk.xsl</Referanse>
		</Visningsfil>
		<Visningsfil>
			<Beskrivelse>Funksjonsfil som benyttes for alle visningsfiler: kodeverk2template.xsl</Beskrivelse>
			<Referanse>visningsfil/felleskomponenter/kodeverk2template.xsl</Referanse>
		</Visningsfil>
		<Visningsfil>
			<Beskrivelse>Funksjonsfil som benyttes for alle visningsfiler: kritiskInfo2html-v2.5.xsl</Beskrivelse>
			<Referanse>visningsfil/felleskomponenter/kritiskInfo2html-v2.5.xsl</Referanse>
		</Visningsfil>
		<Visningsfil>
			<Beskrivelse>Funksjonsfil som benyttes for alle visningsfiler: legemiddel2html.xsl</Beskrivelse>
			<Referanse>visningsfil/felleskomponenter/legemiddel2html.xsl</Referanse>
		</Visningsfil>
		<Visningsfil>
			<Beskrivelse>Funksjonsfil som benyttes for alle visningsfiler: meldingshode2html.xsl</Beskrivelse>
			<Referanse>visningsfil/felleskomponenter/meldingshode2html.xsl</Referanse>
		</Visningsfil>
		<Visningsfil>
			<Beskrivelse>Funksjonsfil som benyttes for alle visningsfiler: poKomponent2html.xsl</Beskrivelse>
			<Referanse>visningsfil/felleskomponenter/poKomponent2html.xsl</Referanse>
		</Visningsfil>
		<Visningsfil>
			<Beskrivelse>Funksjonsfil som benyttes for alle visningsfiler (Fra SourceForge): date-time.xsl</Beskrivelse>
			<Referanse>visningsfil/felleskomponenter/SourceForge/date-time.xsl</Referanse>
		</Visningsfil>
		<Visningsfil>
			<Beskrivelse>Funksjonsfil som benyttes for alle visningsfiler (Fra SourceForge): stdlib.xsl</Beskrivelse>
			<Referanse>visningsfil/felleskomponenter/SourceForge/stdlib.xsl</Referanse>
		</Visningsfil>
		<Visningsfil>
			<Beskrivelse>Funksjonsfil som benyttes for alle visningsfiler (Fra SourceForge): string.xsl</Beskrivelse>
			<Referanse>visningsfil/felleskomponenter/SourceForge/string.xsl</Referanse>
		</Visningsfil>
	</Visningsfiler>
	
</StandardMetadata>
