<?xml version="1.0" encoding="UTF-8"?>
<!-- edited with XMLSpy v2013 rel. 2 sp2 (http://www.altova.com) by eResept (Helsedirektoratet) -->
<StandardMetadata definisjonVersjon="" xmlns:xsi="http://www.w3.org/2001/XMLSchema-instance" xsi:noNamespaceSchemaLocation="../Metadata.xsd">
	<Temaer>
		<Tema>E-reseptmeldinger - ny versjon</Tema> 
	</Temaer>
	<Navn>Nettutleverer</Navn>
	<Versjon>2.5</Versjon>
	<Utgitt>07/2018</Utgitt>
	<Ansvarlig>Direktoratet for e-helse</Ansvarlig>
	<Status>Fastsatt som standard</Status>
	<MerInformasjon>
		<Informasjon>
			<Beskrivelse>Om bruk og målgrupper</Beskrivelse>
			<Referanse>https://ehelse.no/referansekatalog/referansekatalogen-for-ehelse#E-reseptmeldinger</Referanse>
		</Informasjon>
	</MerInformasjon> 

	<Kravdokumenter>
		<Kravdokument>
			<Beskrivelse>M9NA1 Forespørsel om reseptliste fra nettkunde (PDF)</Beskrivelse>
			<Referanse>kravdokument/eresept/HIS 3016_2018 M9NA1 Forespørsel om reseptliste fra nettkunde.pdf</Referanse>
		</Kravdokument>
		<Kravdokument>
			<Beskrivelse>M9NA2 Reseptliste nettkunde (PDF)</Beskrivelse>
			<Referanse>kravdokument/eresept/HIS 3017_2018 M9NA2 Reseptliste nettkunde.pdf</Referanse>
		</Kravdokument>
		<Kravdokument>
			<Beskrivelse>M9NA3 Forespørsel om utvidet informasjon på resept fra nettkunde (PDF)</Beskrivelse>
			<Referanse>kravdokument/eresept/HIS 3018_2018 M9NA3 Forespørsel om utvidet informasjon på resept fra nettkunde.pdf</Referanse>
		</Kravdokument>
		<Kravdokument>
			<Beskrivelse>M9NA4 Utvidet informasjon om resept nettkunde (PDF)</Beskrivelse>
			<Referanse>kravdokument/eresept/HIS 3019_2018 M9NA4 Utvidet informasjon på resept fra nettkunde.pdf</Referanse>
		</Kravdokument>
		<Kravdokument>
			<Beskrivelse>eResept – Verify-melding (PDF)</Beskrivelse>
			<Referanse>kravdokument/eresept/eResept-MV-2013-08-16.pdf</Referanse>
		</Kravdokument>
	</Kravdokumenter>
	
	<Skjemaer>
		<Skjema>
			<Referanse>skjema/eresept/ER-M9NA1-2016-06-06.xsd</Referanse>
			<Namespace>http://www.kith.no/xmlstds/eresept/m9na1/2016-06-06</Namespace>
		</Skjema>
		<Skjema>
			<Referanse>skjema/eresept/ER-M9NA2-2016-10-26.xsd</Referanse>
			<Namespace>http://www.kith.no/xmlstds/eresept/m9na2/2016-10-26</Namespace>
		</Skjema>
		<Skjema>
			<Referanse>skjema/eresept/ER-M9NA3-2016-06-06.xsd</Referanse>
			<Namespace>http://www.kith.no/xmlstds/eresept/m9na3/2016-06-06</Namespace>
		</Skjema>
		<Skjema>
			<Referanse>skjema/eresept/ER-M9NA4-2016-06-06.xsd</Referanse>
			<Namespace>http://www.kith.no/xmlstds/eresept/m9na4/2016-06-06</Namespace>
		</Skjema>
	</Skjemaer>
	<Felleskomponenter>
		<Felleskomponent>
			<Referanse>skjema/felleskomponenter/MsgHead-v1_2.xsd</Referanse>
		</Felleskomponent>
		<Felleskomponent>
			<Referanse>skjema/felleskomponenter/kith-base64.xsd</Referanse>
		</Felleskomponent>
		<Felleskomponent>
			<Referanse>skjema/felleskomponenter/felleskomponent1.xsd</Referanse>
		</Felleskomponent>
		<Felleskomponent>
			<Referanse>skjema/felleskomponenter/kith.xsd</Referanse>
		</Felleskomponent>
	</Felleskomponenter>

	<RelaterteFiler>
		<RelatertFil>
			<Beskrivelse>Applikasjonskvittering v 1.0 </Beskrivelse>
			<Referanse>kravdokument/applikasjonskvittering/HIS_80415_2004 AppRec v1.0 -korrigert.pdf</Referanse>
		</RelatertFil>
		<RelatertFil>
			<Beskrivelse>Notat til bruk av kith-base.xsd </Beskrivelse>
			<Referanse>relaterteFiler/eresept/NOTAT-kith-base64.pdf</Referanse>
		</RelatertFil>
		<RelatertFil>
			<Beskrivelse>Hodemelding v 1.2 </Beskrivelse>
			<Referanse>kravdokument/hodemelding/HIS_80601_2006-Hodemelding-v12 -korrigert.pdf</Referanse>
		</RelatertFil>
		<RelatertFil>
			<Beskrivelse>Datatyper v 1.1 </Beskrivelse>
			<Referanse>kravdokument/DatatyperTilBrukVedMeldingsutveksling/HIS_80117_2002_Datatyper_v1.1 -korrigert.pdf</Referanse>
		</RelatertFil>
		<RelatertFil>
			<Beskrivelse>Notat - Opplysninger om signerende helsepersoenell i meldinger fra Helseforetak til NAV og Reseptformidleren </Beskrivelse>
			<Referanse>relaterteFiler/eresept/Signerende_HelsepersonellSykmelding-eResept-notat.pdf</Referanse>
		</RelatertFil>
	</RelaterteFiler>	
	 
	
</StandardMetadata>
