<?xml version="1.0" encoding="UTF-8"?>
<!-- edited with XMLSpy v2013 rel. 2 sp2 (http://www.altova.com) by eResept (Helsedirektoratet) -->
<StandardMetadata definisjonVersjon="" xmlns:xsi="http://www.w3.org/2001/XMLSchema-instance" xsi:noNamespaceSchemaLocation="../Metadata.xsd">
	<Navn>Henvisningsmelding</Navn>
	<Versjon>2.0</Versjon>
	<Identifikator>HIS 80517 Utprøving 2017</Identifikator>
	<Utgitt>02/2017</Utgitt>

	<Status>Til pilotering</Status>
	<ForrigeVersjon>HIS 80517:2014</ForrigeVersjon>
	
	<Kravdokumenter>
		<Kravdokument>
			<Beskrivelse>Henvisning. Informasjonsmodell og XML meldingsbeskrivelse (GitLab)</Beskrivelse>
			<Referanse>kravdokument/henvisning/HIS_80517_2017 Henvisning 2.0 til utprøving.pdf</Referanse>
		</Kravdokument>
	</Kravdokumenter>
	
	<Skjemaer>
		<Skjema>
			<Referanse>skjema/henvisning/Henvisning-v2.0.xsd</Referanse>
			<Namespace>http://www.kith.no/xmlstds/henvisning/2014-04-30</Namespace>
		</Skjema>
		<Skjema>
			<Beskrivelse>Komponenter som gjenbrukes i flere ulike Pleie- og omsorgsmeldinger</Beskrivelse>
			<Referanse>skjema/plo/v1.6/poKomponent-v1.6.xsd</Referanse>
			<Namespace>http://www.kith.no/xmlstds/po/poKomponent/2012-04-01</Namespace>
		</Skjema>
	</Skjemaer>
	
	<Felleskomponenter>
		<Felleskomponent>
			<Beskrivelse>Felles XML-definisjoner for person, helsepersonell, organisasjon etc</Beskrivelse>
			<Referanse>skjema/felleskomponenter/felleskomponent1.xsd</Referanse>
		</Felleskomponent>
		<Felleskomponent>
			<Beskrivelse>Felles datatyper</Beskrivelse>
			<Referanse>skjema/felleskomponenter/kith.xsd</Referanse>
		</Felleskomponent>
		<Felleskomponent>
			<Beskrivelse>Container for Base64-kodet innhold</Beskrivelse>
			<Referanse>skjema/felleskomponenter/kith-base64.xsd</Referanse>
		</Felleskomponent>
		<Felleskomponent>
			<Beskrivelse>XML-skjema for Hodemelding</Beskrivelse>
			<Referanse>skjema/felleskomponenter/MsgHead-v1_2.xsd</Referanse>
		</Felleskomponent>
	</Felleskomponenter>
	
	<Visningsfiler>
		<Visningsfil>
			<Beskrivelse>Felleskomponent for alle visningsfiler: KITH-visning.css</Beskrivelse>
			<Referanse>visningsfil/felleskomponenter/KITH-visning.css</Referanse>
		</Visningsfil>
		<Visningsfil>
			<Beskrivelse>Funksjonsfil som benyttes for alle visningsfiler: base64decoder.xsl</Beskrivelse>
			<Referanse>visningsfil/felleskomponenter/base64decoder.xsl</Referanse>
		</Visningsfil>
		<Visningsfil>
			<Beskrivelse>Funksjonsfil som benyttes for alle visningsfiler: base64-konverterer.xsl</Beskrivelse>
			<Referanse>visningsfil/felleskomponenter/base64-konverterer.xsl</Referanse>
		</Visningsfil>
		<Visningsfil>
			<Beskrivelse>Funksjonsfil som benyttes for alle visningsfiler:cave2html.xsl</Beskrivelse>
			<Referanse>visningsfil/felleskomponenter/cave2html.xsl</Referanse>
		</Visningsfil>
		<Visningsfil>
			<Beskrivelse>Funksjonsfil som benyttes for alle visningsfiler:datamap.xml</Beskrivelse>
			<Referanse>visningsfil/felleskomponenter/datamap.xml</Referanse>
		</Visningsfil>
		<Visningsfil>
			<Beskrivelse>Funksjonsfil som benyttes for alle visningsfiler: EPJ-cave2html.xsl</Beskrivelse>
			<Referanse>visningsfil/felleskomponenter/EPJ-cave2html.xsl</Referanse>
		</Visningsfil>
		<Visningsfil>
			<Beskrivelse>Funksjonsfil som benyttes for alle visningsfiler: EPJ-journalnotat2html.xsl</Beskrivelse>
			<Referanse>visningsfil/felleskomponenter/EPJ-journalnotat2html.xsl</Referanse>
		</Visningsfil>
		<Visningsfil>
			<Beskrivelse>Funksjonsfil som benyttes for alle visningsfiler: EPJ-legemiddel2html.xsl</Beskrivelse>
			<Referanse>visningsfil/felleskomponenter/EPJ-legemiddel2html.xsl</Referanse>
		</Visningsfil>
		<Visningsfil>
			<Beskrivelse>Funksjonsfil som benyttes for alle visningsfiler: funksjoner.xsl</Beskrivelse>
			<Referanse>visningsfil/felleskomponenter/funksjoner.xsl</Referanse>
		</Visningsfil>
		<Visningsfil>
			<Beskrivelse>Funksjonsfil som benyttes for alle visningsfiler: journalnotat2html.xsl</Beskrivelse>
			<Referanse>visningsfil/felleskomponenter/journalnotat2html.xsl</Referanse>
		</Visningsfil>
		<Visningsfil>
			<Beskrivelse>Funksjonsfil som benyttes for alle visningsfiler: kodeverk.xsl</Beskrivelse>
			<Referanse>visningsfil/felleskomponenter/kodeverk.xsl</Referanse>
		</Visningsfil>
		<Visningsfil>
			<Beskrivelse>Funksjonsfil som benyttes for alle visningsfiler: kodeverk2template.xsl</Beskrivelse>
			<Referanse>visningsfil/felleskomponenter/kodeverk2template.xsl</Referanse>
		</Visningsfil>
		<Visningsfil>
			<Beskrivelse>Funksjonsfil som benyttes for alle visningsfiler: kritiskInfo2html-v2.5.xsl</Beskrivelse>
			<Referanse>visningsfil/felleskomponenter/kritiskInfo2html-v2.5.xsl</Referanse>
		</Visningsfil>
		<Visningsfil>
			<Beskrivelse>Funksjonsfil som benyttes for alle visningsfiler: legemiddel2html.xsl</Beskrivelse>
			<Referanse>visningsfil/felleskomponenter/legemiddel2html.xsl</Referanse>
		</Visningsfil>
		<Visningsfil>
			<Beskrivelse>Funksjonsfil som benyttes for alle visningsfiler: meldingshode2html.xsl</Beskrivelse>
			<Referanse>visningsfil/felleskomponenter/meldingshode2html.xsl</Referanse>
		</Visningsfil>
		<Visningsfil>
			<Beskrivelse>Funksjonsfil som benyttes for alle visningsfiler: poKomponent2html.xsl</Beskrivelse>
			<Referanse>visningsfil/felleskomponenter/poKomponent2html.xsl</Referanse>
		</Visningsfil>
		<Visningsfil>
			<Beskrivelse>Funksjonsfil som benyttes for alle visningsfiler (Fra SourceForge): date-time.xsl</Beskrivelse>
			<Referanse>visningsfil/felleskomponenter/SourceForge/date-time.xsl</Referanse>
		</Visningsfil>
		<Visningsfil>
			<Beskrivelse>Funksjonsfil som benyttes for alle visningsfiler (Fra SourceForge): stdlib.xsl</Beskrivelse>
			<Referanse>visningsfil/felleskomponenter/SourceForge/stdlib.xsl</Referanse>
		</Visningsfil>
		<Visningsfil>
			<Beskrivelse>Funksjonsfil som benyttes for alle visningsfiler (Fra SourceForge): string.xsl</Beskrivelse>
			<Referanse>visningsfil/felleskomponenter/SourceForge/string.xsl</Referanse>
		</Visningsfil>
	</Visningsfiler>	
</StandardMetadata>
