<?xml version="1.0" encoding="UTF-8"?>
<!-- edited with XMLSpy v2013 rel. 2 sp2 (http://www.altova.com) by eResept (Helsedirektoratet) -->
<StandardMetadata definisjonVersjon="" xmlns:xsi="http://www.w3.org/2001/XMLSchema-instance" xsi:noNamespaceSchemaLocation="../Metadata.xsd">
	<Navn>Dialogmelding</Navn>
	<Versjon>1.1</Versjon>
	<Identifikator>HIS 80603:2017</Identifikator>
	<Utgitt>02/2017</Utgitt>
	<Utgiver>Direktoratet for e-helse</Utgiver>
	<Referansekatalogen>
		<Beskrivelse>Dialogmelding 1.1 (HIS 80603:2017)</Beskrivelse>
		<Referanse>http://ehelse.no/HIS80603-2017</Referanse>
	</Referansekatalogen>
	<Status>Fastsatt som standard</Status>

	<Kravdokumenter>
		<Kravdokument>
			<Beskrivelse>Dialogmelding v1.1 (GitLab)</Beskrivelse>
			<Referanse>kravdokument/dialogmelding/v11/HIS 80603_2017 Standard for dialogmelding.pdf</Referanse>
		</Kravdokument>
		<Kravdokument>
			<Beskrivelse>Profil: Digital dialog (GitLab)</Beskrivelse>
			<Referanse>kravdokument/dialogmelding/v11/HIS 1176_2017 Digital dialog Profil av dialogmelding.pdf</Referanse>
		</Kravdokument>
		<Kravdokument>
			<Beskrivelse>Profil: Helsefaglig dialog (GitLab)</Beskrivelse>
			<Referanse>kravdokument/dialogmelding/v11/HIS 1077_2017 Helsefaglig dialog.pdf</Referanse>
		</Kravdokument>
		<Kravdokument>
			<Beskrivelse>Profil: Status på henvisning (GitLab)</Beskrivelse>
			<Referanse>kravdokument/dialogmelding/v11/HIS_1206-2018 Status på henvisning.pdf</Referanse>
		</Kravdokument>
	</Kravdokumenter>

	<Skjemaer>
		<Skjema>
			<Referanse>skjema/dialogmelding/2013-01-23/dialogmelding-v1.1.xsd</Referanse>
			<Namespace>http://www.kith.no/xmlstds/dialog/2013-01-23</Namespace>
		</Skjema>
	</Skjemaer>

	<Felleskomponenter>
		<Felleskomponent>
			<Beskrivelse>Felles XML-definisjoner for person, helsepersonell, organisasjon etc </Beskrivelse>
			<Referanse>skjema/felleskomponenter/felleskomponent1.xsd</Referanse>
		</Felleskomponent>
		<Felleskomponent>
			<Beskrivelse>Felles datatyper</Beskrivelse>
			<Referanse>skjema/felleskomponenter/kith.xsd</Referanse>
		</Felleskomponent>
	</Felleskomponenter>
	
	<Visningsfiler>
		<Visningsfil>
			<Referanse>visningsfil/dialogmelding/v1.1/Dialog-v1_1-2html.xsl</Referanse>
		</Visningsfil>
		<Visningsfil>
			<Referanse>visningsfil/dialogmelding/v1.1/Dialog-v1_1-2html-forIE.xsl</Referanse>
		</Visningsfil>
		<Visningsfil>
			<Beskrivelse>Felleskomponent for alle visningsfiler: smooth-visning.css</Beskrivelse>
			<Referanse>visningsfil/felleskomponenter/smooth-visning.css</Referanse>
		</Visningsfil>
		<Visningsfil>
			<Beskrivelse>Felleskomponent for alle visningsfiler: eh-komponent2.xsl</Beskrivelse>
			<Referanse>visningsfil/felleskomponenter/eh-komponent2.xsl</Referanse>
		</Visningsfil>
		<Visningsfil>
			<Beskrivelse>Felleskomponent for alle visningsfiler: KITH-visning.css</Beskrivelse>
			<Referanse>visningsfil/felleskomponenter/KITH-visning.css</Referanse>
		</Visningsfil>
		<Visningsfil>
			<Beskrivelse>Funksjonsfil som benyttes for alle visningsfiler: base64decoder.xsl</Beskrivelse>
			<Referanse>visningsfil/felleskomponenter/base64decoder.xsl</Referanse>
		</Visningsfil>
		<Visningsfil>
			<Beskrivelse>Funksjonsfil som benyttes for alle visningsfiler: base64-konverterer.xsl</Beskrivelse>
			<Referanse>visningsfil/felleskomponenter/base64-konverterer.xsl</Referanse>
		</Visningsfil>
		<Visningsfil>
			<Beskrivelse>Funksjonsfil som benyttes for alle visningsfiler:cave2html.xsl</Beskrivelse>
			<Referanse>visningsfil/felleskomponenter/cave2html.xsl</Referanse>
		</Visningsfil>
		<Visningsfil>
			<Beskrivelse>Funksjonsfil som benyttes for alle visningsfiler:datamap.xml</Beskrivelse>
			<Referanse>visningsfil/felleskomponenter/datamap.xml</Referanse>
		</Visningsfil>
		<Visningsfil>
			<Beskrivelse>Funksjonsfil som benyttes for alle visningsfiler: EPJ-cave2html.xsl</Beskrivelse>
			<Referanse>visningsfil/felleskomponenter/EPJ-cave2html.xsl</Referanse>
		</Visningsfil>
		<Visningsfil>
			<Beskrivelse>Funksjonsfil som benyttes for alle visningsfiler: EPJ-journalnotat2html.xsl</Beskrivelse>
			<Referanse>visningsfil/felleskomponenter/EPJ-journalnotat2html.xsl</Referanse>
		</Visningsfil>
		<Visningsfil>
			<Beskrivelse>Funksjonsfil som benyttes for alle visningsfiler: EPJ-legemiddel2html.xsl</Beskrivelse>
			<Referanse>visningsfil/felleskomponenter/EPJ-legemiddel2html.xsl</Referanse>
		</Visningsfil>
		<Visningsfil>
			<Beskrivelse>Funksjonsfil som benyttes for alle visningsfiler: funksjoner.xsl</Beskrivelse>
			<Referanse>visningsfil/felleskomponenter/funksjoner.xsl</Referanse>
		</Visningsfil>
		<Visningsfil>
			<Beskrivelse>Funksjonsfil som benyttes for alle visningsfiler: journalnotat2html.xsl</Beskrivelse>
			<Referanse>visningsfil/felleskomponenter/journalnotat2html.xsl</Referanse>
		</Visningsfil>
		<Visningsfil>
			<Beskrivelse>Funksjonsfil som benyttes for alle visningsfiler: kodeverk.xsl</Beskrivelse>
			<Referanse>visningsfil/felleskomponenter/kodeverk.xsl</Referanse>
		</Visningsfil>
		<Visningsfil>
			<Beskrivelse>Funksjonsfil som benyttes for alle visningsfiler: kodeverk2template.xsl</Beskrivelse>
			<Referanse>visningsfil/felleskomponenter/kodeverk2template.xsl</Referanse>
		</Visningsfil>
		<Visningsfil>
			<Beskrivelse>Funksjonsfil som benyttes for alle visningsfiler: kritiskInfo2html-v2.5.xsl</Beskrivelse>
			<Referanse>visningsfil/felleskomponenter/kritiskInfo2html-v2.5.xsl</Referanse>
		</Visningsfil>
		<Visningsfil>
			<Beskrivelse>Funksjonsfil som benyttes for alle visningsfiler: legemiddel2html.xsl</Beskrivelse>
			<Referanse>visningsfil/felleskomponenter/legemiddel2html.xsl</Referanse>
		</Visningsfil>
		<Visningsfil>
			<Beskrivelse>Funksjonsfil som benyttes for alle visningsfiler: meldingshode2html.xsl</Beskrivelse>
			<Referanse>visningsfil/felleskomponenter/meldingshode2html.xsl</Referanse>
		</Visningsfil>
		<Visningsfil>
			<Beskrivelse>Funksjonsfil som benyttes for alle visningsfiler: poKomponent2html.xsl</Beskrivelse>
			<Referanse>visningsfil/felleskomponenter/poKomponent2html.xsl</Referanse>
		</Visningsfil>
		<Visningsfil>
			<Beskrivelse>Funksjonsfil som benyttes for alle visningsfiler (Fra SourceForge): date-time.xsl</Beskrivelse>
			<Referanse>visningsfil/felleskomponenter/SourceForge/date-time.xsl</Referanse>
		</Visningsfil>
		<Visningsfil>
			<Beskrivelse>Funksjonsfil som benyttes for alle visningsfiler (Fra SourceForge): stdlib.xsl</Beskrivelse>
			<Referanse>visningsfil/felleskomponenter/SourceForge/stdlib.xsl</Referanse>
		</Visningsfil>
		<Visningsfil>
			<Beskrivelse>Funksjonsfil som benyttes for alle visningsfiler (Fra SourceForge): string.xsl</Beskrivelse>
			<Referanse>visningsfil/felleskomponenter/SourceForge/string.xsl</Referanse>
		</Visningsfil>
	</Visningsfiler>
 

</StandardMetadata>
